University_Name,College_Dep,Degree_Category,DS_or_BA,Year_Est,Full_Address,Long,Lat,State,Deg_Desc,URL
Montclair State University, Feliciano School of Business, M.S. in Business Analytics,BA,2018,"Valley Road Normal Avenue, Montclair, NJ 07043-1624",-74.20228024,40.85796328,NJ,"The MS in Business Analytics program offered at Montclair State University is designed to meet the growing demand for business analytics professionals and prepare graduates to conduct planning, decision-making and operations using timely, fact-based insights and knowledge.  The program is aimed at working professionals from technical or business backgrounds, who seek career advancement, enhancement or change.

Students will gain competitive advantage with an industry-aligned curriculum, experiential learning opportunities, and access to a diverse network of experts and practitioners. Coursework emphasizes analytics skills for statistical/predictive modeling, and includes enterprise architecture, data visualization & management and data mining. Throughout the program, participants apply those skills in assessing real-world business problems and opportunities. Emphasis is placed on developing actionable solutions and recommendations, and effectively communicating results to business managers and other stakeholders . Students emerge with the strategic asset most companies are seeking:  expertise in analyzing complex business challenges using appropriate data and up-to-date technology and tools.",https://business.montclair.edu/programs/graduate-programs/ms-in-business-analytics
New York University, Stern School of Business (NYC and Shanghai campuses), M.S. in Data Analytics and Business Computing,DA,2018,"70 Washington Square South, New York, NY 10012-1091",-73.99698732,40.72972537,NY,"The Master of Science in Data Analytics & Business Computing seeks to prepare pre-experience students with a strong analytical background for careers in a fast-growing field of business analytics. Students will learn how to use a data-driven approach to solve business challenges in the era of big data. With the interdisciplinary nature of business analytics, our program offers a broad yet rigorous curriculum in business (finance, marketing, revenue management, operations), data science (statistics, econometrics, data mining, data visualization), and management science (optimization, stochastic modeling, simulation). We emphasize both quantitative and technical methods and their applications in different functional areas in business. Students will benefit from the extensive industry experience of our faculty and seasoned professionials in the field.

Our program is a sister program of Stern’s MS program in Business Analytics (MSBA), which has been consistently in high demand in this field since its inception. While the MSBA program is for senior-level professionals, our MS program in Data Analytics and Business Computing caters to motivated pre-experience students or recent college graduates.",https://stern.shanghai.nyu.edu/en/program/ms-data-analytics-business-computing
Ohio State University, Fisher College of Business, Specialized Masters in Business Analytics,BA,2018,"1585 Neil Avenue, Columbus, OH 43210",-83.01441536,39.9940095,OH,"The Specialized Master in Business Analytics (SMB-A) program is designed to develop next-generation managers capable of leveraging practical approaches to analysis, informed decision-making and systems thinking.  Our program equips students with real-world knowledge of how applied statistics, applications in machine learning and data visualization tactics can be used to inform advances in productivity, market position, and business innovation.
Become a future data-savvy manager and leader in business analytics. Our SMB-A graduates can:

Demonstrate fluency in working with data and an understanding of data acquisition and management in organizations to meet specified business objectives.
Conceptualize real-world problems, identify data requirements, engage in rigorous critical thinking, and develop innovative solutions through the application of (a) descriptive; (b) predictive; and (c) prescriptive data analytic methods and techniques.
Demonstrate competence in communicating tractable results and integrated insights that inform organizational decision-making.
Apply business knowledge in management analytics, including team leadership.
Identify and evaluate ethical issues surrounding data and its use in decision making.
Learn systems thinking, which involves taking a broad and pragmatic perspective when analyzing structures, patterns, and feedback mechanisms in real-world contexts. you'll have the correct mindset to address chronic issues others may have been unable to solve.",https://fisher.osu.edu/graduate/smb-a
Penn State Great Valley, School of Graduate Professional Studies, M.S. in Data Analytics,DA,2018,"30 E. Swedesford Road, Malvern, PA 19355-1488",-75.522249,40.052961,PA,"Through its emphasis on research, this program is designed to prepare students for entry into doctoral programs in data analytics. MS-DAAN has five required courses and three electives. Students take a research methods class and must pass SARI requirements prior to graduation. Rather than a capstone course, the program requires a thesis paper, which is six credits taken over two terms, and the completion of CITI training. Students work with and assigned faculty adviser for the course of their research. In order to graduate, the thesis must be accepted by a committee, the head of the graduate program, and the chancellor. Recent thesis papers have focused on information extraction and simplification from complicated medical notes, predicting Autism Spectrum Disorder based on genetic profiles, economic loss caused by disruption in infrastructure networks, and more.",https://greatvalley.psu.edu/academics/masters-degrees/data-analytics
Rochester Institute of Technology, Saunders College of Business, M.S. in Business Analytics,BA,2018,"1 Lomb Memorial Dr, Rochester, NY 14623-5603",-77.673222,43.081983,NY,The Business Analytics Master of Science degree prepares you to manage the unprecedented amounts of data businesses are creating. Gain control of Big Data to deliver powerful analytics solutions to help companies make better business decisions.,https://saunders.rit.edu/graduate/programs/master-business-analytics
Rochester Institute of Technology, Golisano College of Computing and Information Sciences, M.S. in Data Science,DS,2018,"1 Lomb Memorial Dr, Rochester, NY 14623-5603",-77.673222,43.081983,NY,"Designed for working professionals studying online part-time, this degree program has a strong career focus. You’ll learn both practical and theoretical skills to handle large-scale data management and analysis challenges ever-present in today’s data-driven organizations. This program places a unique focus on training data scientists in strong software engineering skills so that they can effectively develop real-world data science applications which operate within modern organizations' computational workflows. You’ll be learning with students from varied professional backgrounds and working with practitioners active in the field to provide hands-on experience solving real problems. ",https://www.rit.edu/online/study/data-science-ms
San Francisco State University, College of Business, M.S. in Business Analytics,BA,2018,"1600 Holloway Ave, San Francisco, CA 94132",-122.4770805,37.7208483,CA,"The Master of Science in Business Analytics (MSBA) program provides rigorous training in scraping, querying, wrangling, and analyzing large data sets using descriptive, predictive and prescriptive techniques. The program includes intensive study in the following seven required courses and three electives:

Applied Multivariate Methods
Data Mining & Advanced Statistical Methods
Machine Learning for Business Analysts
Business Intelligence
Programming Languages for Analytics
Data Management for Analytics
Practicum Project
Students elect to take three advanced courses in a variety of domains: marketing, computer science, economics, finance, decision sciences, information systems, accounting, etc. The list of electives below is not exhaustive.

Natural Language Processing
Applied Time Series Econometrics
Mobile Applications
Marketing Analytics
Supply Chain Management
Digital Marketing",https://cob.sfsu.edu/graduate-programs/business-analytics
San Jose State University, College of Professional and Global Education, M.S. in Data Analytics,DA,2018,"1 Washington Sq, San Jose, CA 95192-0001",-121.8806302,37.33444809,CA,"The Master of Science in Data Analytics (MSDA) program offered by the Department of Applied Data Science is developed in partnership with industry experts targeting students from diverse academic and professional backgrounds. 

Starting in Fall 2020, the MSDA program will be offered through both Regular Session and Special Session.

Students receive the advanced education necessary to apply analytics to solve real-world problems by immersing them in the full data analytics process lifecycle.

Students learn how to build portfolios of data analytics projects by leveraging the interrelationship between domain data knowledge and emerging information technologies. Students advance their knowledge and skills through the integration of:

Identifying domain specific problems, defining requirements, and establishing measurable organizational objectives.
Performing data exploration, preparation, visualization and governance.
Applying programming, statistics, database, data mining, and machine learning technologies to build models for descriptive, diagnostic, predictive and prescriptive analytics.
Engaging in the development, validation and monitoring of data analytics systems to meet requirements and objectives.",https://www.sjsu.edu/pdp/programs/msda/
State University of New York at Plattsburgh, School of Business & Economics, M.S. in Data Analytics,DA,2018,"101 Broad Street, Plattsburgh, NY 12901",-73.4660595,44.694477,NY,"The program is a powerful blend of quantitative coursework and real-world applications. Using current industry-standard tools, our hands-on, lab-based courses give you practical experience:

Use advanced data queries and processing tools to access, clean, transform and integrate data from a variety of sources for visualization, modeling and interpretation.
Apply data integration, data visualization, and data and text mining techniques to identify and analyze useful patterns in data.
Estimate and predict the likelihood of future outcomes based on data to provide organizations with actionable insights.
Apply mathematical optimization and simulation techniques to quantify the effect of future decisions and advise organizations on possible outcomes.
Present complex results and communicate findings and insights in non-technical and clear business language to inform significant business decisions.
Use interpersonal and leadership skills in analytics teams to design creative data analytics solutions to complex business problems.",https://www.plattsburgh.edu/programs/data-analytics-masters.html
Tulane University, Freeman School of Business, Master of Business Analytics,BA,2018,"6823 Saint Charles Avenue, New Orleans, LA 70118-5698",-90.12320149,29.93483069,LA,"In our STEM-designated, career-focused master’s degree program in business analytics, you will analyze real-world data sets and learn how to leverage your findings to make evidence-based business decisions.

You’ll be prepared to enter an in-demand field with analytics skills employers need.

Learning from our distinguished faculty members, you’ll be grounded in the practical application of business analytics to provide a seamless transition to your career. You’ll learn how to apply computing, analytic, and economic insight from data sets to manage, interpret, model and communicate results. You’ll enter your career confident to make significant contributions in analysis, problem solving, risk management, and strategic analysis and planning.",https://freeman.tulane.edu/graduate/master-business-analytics
University of Alabama at Birmingham, College of Arts and Sciences, M.S. in Data Science,DS,2018,"1720 2nd Avenue South, Birmingham, AL 35233",-86.80720322,33.50907265,AL,"The Master of Science in Data Science program prepares graduate students for a professional career in the field of big data. Students will be equipped with fundamental knowledge and skills in data science and analytics, including:

machine learning,
modelling and quantitative analysis of massive datasets,
application of such technologies in strategic decisions,
critical skills for collecting and managing massive datasets, and
implementation of efficient solutions to real world big data problems using the most appropriate algorithmic techniques and software development tools available.
The program includes a set of core required courses and provides an opportunity for students to select from a wide range of electives related to data analytics, biostatistics, bioinformatics, business intelligence, and cyber security.",https://www.uab.edu/cas/computerscience/graduate-programs/masters-programs/msds
University of Delaware," College of Agriculture and Natural Resources,  College of Arts and Science  and College of Engineering",M.S. in Data Science,DS,2018,"104 Hullihen Hall, Newark, DE 19716",-75.75367295,39.6800067,DE,"The M.S. in data science is a professional master's degree with a flexible set of core requirements in statistics, mathematics and computer and information sciences. It is aimed at providing a solid background in the methods behind data science to work with large and/or dynamic data sets. The program provides both the breadth of training and the flexibility to apply it in different fields. The flexibility allows for training in different categories of positions in data science. Data analysts use mathematical, statistical and modeling techniques to solve problems; data engineers design, build and maintain an organization’s data and analytical infrastructure; and data scientists create sophisticated analytical models to build new data sets and derive new insights from data.",https://www.udel.edu/academics/colleges/grad/prospective-students/programs/data-scientist/
University of Findlay, College of Sciences, M.S. in Applied Security and Analytics,A,2018,"1000 N Main St, Findlay, OH 45840-3695",-83.65011596,41.053716,OH,"Enhance your IT knowledge through Findlay's online Master of Science in Applied Security and Analytics Program. Our advanced courses in leadership, big data analytics and cybersecurity will expand your business skills in strategic planning, finance, security and project management.",https://www.findlay.edu/sciences/applied-security-analytics-masters/
University of Georgia, Terry College of Business, M.S. in Business Analytics,BA,2018,"456 East Broad Street, Athens, GA 30602",-83.37309846,33.958138,GA,"The Master of Science in Business Analytics (MSBA) is a one-year interdisciplinary program to help you develop technical expertise in collecting, analyzing, and interpreting big data in a business context. For international students, the program’s STEM-certification provides eligibility for a three-year U.S. work permit upon graduation.

The MSBA program involves two semesters of study (33 total credit hours). During the program, you will develop expertise in the collection, storage, analysis, interpretation, and visualization of data, as well as learn the predominant programming languages in the field, namely SQL, R, and Python. Efficient processing of large quantities of data via platforms like Hadoop and SAS will be included. Business courses in analytics, marketing, economics, and strategy will provide you with frameworks to turn data analyses into business insights. You will also develop leadership, project management, and teamwork skills; as part of the Capstone Project, you will work in teams on real-world big data problems with a corporate partner and present project results to executive clients.?",https://www.terry.uga.edu/msba
University of Louisville, College of Business, M.S. in Business Analytics,BA,2018,"2301 S 3rd St, Louisville, KY 40292-0001",-85.76207421,38.21523786,KY,"The STEM Master of Science in Business Analytics (MSBA) is an accelerated, 13-month program with a team-based structure that creates a rich and diverse learning environment. Students work both in teams and independently to complete the coursework.

The MSBA curriculum combines information systems technologies, data modeling, and analytics with business acumen and impactful communications to develop the skills necessary to become a successful business analyst with excellent potential for professional growth. The program is designed and delivered in collaboration with local businesses to provide a realistic business orientation, increasing your skill relevance in the professional marketplace.",https://business.louisville.edu/academics-programs/graduate-programs/msba/
University of Michigan at Ann Arbor," College of Literature, Science and the Arts",M.S. in Data Science,DS,2018,"2074 Fleming Administration Building, Ann Arbor, MI 48109-1340",-83.743119,42.275826,MI,"Data Science is often viewed as the confluence of (1) Computer and Information Sciences (2) Statistical Sciences, and (3) Domain Expertise. These three pillars are not symmetric: the first two together represent the core methodologies and the techniques used in Data Science, while the third pillar is the application domain to which this methodology is applied. In this program, core data science training is focused on the first two pillars, along with practice in applying their skills to address problems in application domains.

We characterize the required Data Science skills in two categories: statistical skills, such as those taught by the Statistics and Biostatistics departments, and computational skills, such as those taught by the Computer Science and Engineering Division and the School of Information. The design of the program is to require every student to receive balanced training in both areas. To create an academic plan that achieves this balance, and to foster a greater sense of shared community, we do not intend to offer any sub-plans or tracks within the proposed degree program. Rather, we will expect graduates of this program to understand data representation and analysis at an advanced level. 

With the MS in Data Science all students will be able to: identify relevant datasets, apply the appropriate statistical and computational tools to the dataset to answer questions posed by individuals, organizations or governmental agencies, design and evaluate analytical procedures appropriate to the data, and implement these efficiently over large heterogeneous data sets in a multi-computer environment.",https://lsa.umich.edu/stats/masters_students/mastersprograms/data-science-masters-program.html
University of Nebraska–Lincoln, College of Business, M.S. in Business Analytics,BA,2018,"201 Canfield Administration Bldg. 14th & R Street, Lincoln, NE 68588-0419",-96.7010985,40.81689,NE,"A business analytics degree has broad appeal for employers and is designed to build on any background. You will master skills that are transferable to any industry where interpreting and applying data leads to better decisions.
Business analysts are paving the way for innovation in productivity and competition. Core courses for the M.S. in Business Analytics program will provide you with comprehensive skills directly applicable to this emerging discipline.",https://business.unl.edu/academic-programs/departments/supply-chain-management-and-analytics/masters/ms-business-analytics/
University of South Dakota, Beacom School of Business, M.S. in Business Analytics,BA,2018,"414 E Clark St, Vermillion, SD 57069-2390",-96.92495134,42.78252452,SD,"The Master of Science in Business Analytics program prepares our graduates to build and grow successful and rewarding careers in the increasingly data-driven economy. Keeping in mind the exploding demand for business analysts in all sectors of the economy—manufacturing, banking, service, hospitality, agriculture, tourism, retail, etc.—we equip our graduates with the latest concepts, tools, and techniques to analyze business data to predict future performance, identify opportunities to increase revenue; reduce costs; and increase business productivity. The MS in Business Analytics program offers in-depth knowledge and expertise in data management, data analysis, visualization, optimization, and equips graduates with skills in data-driven decision making. Graduates will find rewarding career opportunities in the region, nation, or across the globe. The MS in Business Analytics is a STEM designated program.",https://www.usd.edu/business/business-analytics
University of Southern California, Viterbi School of Engineering, M.S. in Applied Data Science,DS,2018,"University Park, Los Angeles, CA 90089-0012",-118.2861303,34.0209066,CA,"The objective of the USC Viterbi Master of Science in Applied Data Science is to train students with a range of backgrounds to be skilled data scientists.

This program allows strong students trained in either computer science or other engineering or scientific disciplines (or even social science disciplines with a demonstrated aptitude for math and science) to get the training to pursue a career in applied data science.

Students completing this degree will have learned the skills required to work as a data scientist, including a basic understanding of data science techniques, the ability to write data science programs in Python, knowledge and experience in working with both databases and big data infrastructure, skills in applying machine learning and data mining techniques, and knowledge of how to apply these skills to real-world problems.

Our students are immersed in the overall field of data analytics, the role of the analyst and/or data scientist, and the domains where informatics skills can be applied to critical organization missions. They understand how data management, data visualization, data mining, and artificial intelligence techniques (specifically machine learning) are critical to the analysis process and how these can be applied to real-world challenges.

The program features the application of knowledge and skill in hands-on type experiences, with the goal of having students leave the program having “lived in the data.” Through an extensive elective track and our unique professional practicum, students find the specializations that will help them better prepare themselves for the area(s) of analytics in which they hope to contribute.",https://viterbigradadmission.usc.edu/programs/masters/msprograms/data-science/ms-applied-data-science/
University of Virginia, Darden School of Business and McIntire School of Commerce, M.S. in Business Analytics,BA,2018,"1827 University Avenue, Charlottesville, VA 22904",-78.50285834,38.03659593,VA,"The M.S. in Business Analytics program is designed to put students at the intersection of business and analytics by teaching both essential and emerging analytics techniques as well as crucial business fundamentals. The applied, project-based learning enables students to work within real-world scenarios and data and learn how to communicate insights.",https://msba.virginia.edu/
William Paterson University of New Jersey, Cotsakos College of Business, M.S. in Applied Business Analytics,BA,2018,"300 Pompton Rd, Wayne, NJ 07470",-74.199222,40.945959,NJ,"Disruptive technologies and globalization have created a huge demand for well-trained business intelligence and analytics professionals. The master of science in applied business analytics in the Cotsakos College of Business’ program addresses this growing need for well-trained professionals with advanced analytical skills. The program is designed to empower students with the knowledge, tools, skills, and industry preparedness they need to lead in the creation of Big Data-driven insights and solutions.",https://www.wpunj.edu/ccob/departments/marketing-management-professional-sales/graduate-programs/ms-in-applied-Business-Analytics
Yeshiva University, Katz School of Graduate and Professional Studies, M.S. in Data Analytics and Visualization,DA,2018,"500 W 185th St, New York, NY 10033-3299",-73.92982859,40.85075624,NY,"Data analytics professionals shape organizational strategies and impact the bottom line by transforming quantitative data into qualitative insights. They also contribute to the greater social good, using data to address pressing challenges in healthcare, housing, poverty, education and transportation. In the Katz School's M.S. in Data Analytics and Visualization, you’ll learn to transform raw data into insightful output and master the underlying science of predictive and exploratory analyses, as well as techniques for creating visualizations and data narratives.

You’ll become proficient in-demand tools like Python, SQL/NoSQL, Tableau, AWS, ArcGIS and AutoML. And, unlike other data analytics programs, you’ll experiment with basic artificial intelligence and machine-learning techniques. Learn from world-class professionals and get real-world predictive and analytical skills in the heart of New York City. Generous scholarships and financial aid are available.",https://www.yu.edu/katz/programs/graduate/data-analytics-and-visualization
