University_Name,College_Dep,Degree_Category,DS_or_BA,Year_Est,Full_Address,Long,Lat,State,Deg_Desc,URL
North Carolina State University, Institute for Advanced Analytics, M.S. in Analytics,A,2007,"901 Main Campus Drive, Raleigh, NC 27606",-78.67715679,35.77297643,NC,"Our mission: to produce the world’s finest analytics and data science professionals. If you have a mind for mathematics and statistical programming and a passion for working with data, the Master of Science in Analytics (MSA) is your program. The MSA is uniquely designed to equip individuals like yourself for the task of deriving and effectively communicating actionable insights from a vast quantity and variety of data.",https://analytics.ncsu.edu/?page_id=1799
Depaul University, College of Computing and Digital Media, M.S. in Data Science (Formerly the M.S. in Predictive Analytics; renamed in 2018.),DS,2010,"14 E. Jackson Blvd, Chicago, IL 60604",-87.62707347,41.87825166,IL,"The data science master’s will provide you with the technical knowledge and advanced computational skills to meet emerging challenges in big data analytics. With on-campus and online classroom learning formats, you can launch a career in data science with extraordinary faculty members—anytime, anywhere. Our online learning program replicates the classroom experience with 100 percent access to software, faculty advisors, career services, and a large network of alumni. Discover how you can manage and analyze complex data, develop data science models to support decision making, and effectively communicate analytical results to a non-technical audience.",https://www.cdm.depaul.edu/academics/Pages/MS-in-Data-Science.aspx
University of Tennessee at Knoxville, College of Business Administration, M.S. in Business Analytics,BA,2010,"527 Andy Holt Tower, Knoxville, TN 37996-0184",-83.93223,35.95387,TN,"The Master of Science in Business Analytics program develops a student’s technical acumen in deriving insights from large data sets as well as business fundamentals and soft skills like leadership, teamwork and presentations. Our students graduate with both the ability to identify the data relevant to the problem at hand and an understanding of how it can be leveraged to benefit the organization.  
In their final semester, MSBA students work in teams using real data to solve a real problem for one of our industry partners in their capstone project. They communicate with company executives throughout the project, presenting their findings at the end of the semester.",https://haslam.utk.edu/business-analytics-statistics/msba
Carnegie Mellon University, Heinz College, M.I.S.M. in Business Intelligence & Data Analytics (Addition of new BIDA track in the existing Master of Information Systems Management.),DA,2011,"5000 Forbes Ave, Pittsburgh, PA 15213-3890",-79.9433955,40.4446265,PA,"Within the MISM program, the Business Intelligence & Data Analytics (BIDA) pathway goes deeper into the emerging field of analytics, forging experts that change the way companies do business around the world.
The comprehensive curriculum includes advanced analytics coursework in machine learning, structured and unstructured data analytics and predictive modeling. When combined with core technology coursework and experiential learning, BIDA you will arm you with the expertise to become an influencer at any organization.",https://www.heinz.cmu.edu/programs/information-systems-management-master/bida
Louisiana State University at Baton Rouge, Ourso College of Business," M.S. in Analytics (Formerly the M.S. in Information Systems and Decision Sciences,  Concentration in Business Analytics and Business Intelligence; renamed in 2012.)",A,2011,"University Administration, Baton Rouge, LA 70808",-91.158645,30.429445,LA,"The Master of Science in Analytics (MSA) at LSU is an exciting degree offered by the Stephenson Department of Entrepreneurship & Information Systems (SDEIS). It is designed to prepare students to use data-driven methods to contribute to organizational effectiveness and guide decisions.
The STEM-designated program curriculum emphasizes the use of business analytics, business intelligence, and information technology to solve problems, reduce costs, increase revenues, streamline processes, and improve decision-making. Students learn specialized skills and knowledge drawn from the fields of computer science, statistics, operations research, and quality management to achieve results through a mixture of classroom instruction, hands-on exercises, and team-based projects.",https://www.lsu.edu/business/sdeis/academics/ms/index.php
Northwestern University, School of Continuing Studies, M.S. in Data Science (Formerly the M.S. in Predictive Analytics; renamed in 2018.),DS,2011,"633 Clark St, Evanston, IL 60208",-87.6798802,42.04997209,IL,"MSDS students gain critical skills for succeeding in today's data-intensive world. They learn how to utilize relational and document database systems and analytics software built upon open-source systems such as R, Python, and TensorFlow. They learn how to make trustworthy predictions using traditional statistics and machine learning methods.",https://sps.northwestern.edu/masters/data-science/index.php
University of Cincinnati, Lindner College of Business, M.S. in Business Analytics (Formerly M.S. in Quantitative Analysis; renamed in 2011.),BA,2011,"P.O. Box 210063, Cincinnati, OH 45221-0063",-84.504132,39.107133,OH,"In the Master’s in Business Analytics program, students work on real-world projects and learn the skills necessary to succeed in data visualization, statistical modeling, data mining, optimization, and simulation in order to proficiently analyze large datasets and generate actionable insights. Classes include Statistical Computing, Data Mining, Data Management, and Probability Models.",https://business.uc.edu/academics/specialized-masters/business-analytics.html
Drexel University, LeBow College of Business, M.S. in Business Analytics,BA,2012,"3141 Chestnut St, Philadelphia, PA 19104",-75.18690278,39.95376285,PA,"The Master of Science in Business Analytics program at Drexel LeBow prepares students to influence decision-making using insights derived from data analysis. The program incorporates multifaceted areas of study such as statistics, data management and modeling. MS in Business Analytics students learn techniques such as machine learning, natural language processing and deep learning to develop a thorough understanding of analytics approaches and their impact on business strategies and decisions.",https://www.lebow.drexel.edu/academics/graduate/master-of-science/ms-business-analytics
Fordham University, School of Business, M.S. in Business Analytics,BA,2012,"441 E Fordham Rd, Bronx, NY 10458",-73.88989361,40.86093439,NY,"Fordham University’s Master of Science in Business Analytics prepares students for these exciting and lucrative career opportunities by integrating the fields of analytics techniques, data management, information technology, modeling, and statistical analysis to train students to become effective analysts and informed users of business data. ",https://www.fordham.edu/info/21535/business_analytics
Northwestern University, McCormick School of Engineering and Applied Science, M.S. in Analytics,A,2012,"633 Clark St, Evanston, IL 60208",-87.6798802,42.04997209,IL,"Northwestern’s Master of Science in Analytics (MSiA) program teaches students the skills that drive business success in today’s hypercompetitive, data-driven world and aims to produce well-rounded data scientists who possess the rigorous technical training and the business acumen to lead data science teams.",https://www.mccormick.northwestern.edu/analytics/
Rutgers," The State University of New Jersey, Discovery Informatics Institute", Master of Business and Science in Analytics,BA,2012,"Old Queens Building, New Brunswick, NJ 08901-1281",-74.446299,40.497912,NJ,"The Master of Business and Science (MBS) degree in Analytics prepares students for data-driven decision making. The curriculum integrates courses in analytics/data science with courses in business and management, through a professionally guided curriculum. MBS gives students multiple hands on course projects that give them the opportunity to partner with companies, nonprofits, and government agencies. Students are also given the opportunity to do semester long projects through the MBS Externship Exchange program, open to working students, online students, and full/part time students. MBS courses are offered to help working professionals get ahead, with our courses being offered in the evenings and hybrid/online. The MBS Analytics curriculum brings together the fields of computer science, statistics, machine learning, data mining and big data. Students will obtain a variety of skills including the ability to analyze large datasets, the ability to develop modeling solutions to support decision making, and a thorough understanding of how data analysis drives business decision making.",https://mbs.rutgers.edu/program/analytics-discovery-informatics-data-sciences
Southern Methodist University, College of Humanities and Sciences, M.S. in Applied Statistics and Data Analytics,DA,2012,"6425 Boaz St, Dallas, TX 75275-0221",-96.7954,32.77816,TX,"A Master of Science in Applied Statistics and Data Analytics (MASDA) degree from the Department of Statistical Science at SMU prepares you with the statistical foundation and critical thinking skills to tackle today’s problems and those that don’t even exist today. If you have a background that is strong in mathematics, this degree program can help you take the next step to advance into this new and highly sought-after field.",https://www.smu.edu/Dedman/Academics/Departments/Statistics/Graduate
Stevens Institute of Technology, Howe School of Technology Management, M.S. in Business Intelligence and Analytics,BA,2012,"Castle Point On Hudson, Hoboken, NJ 07030-5991",-74.0272077,40.74249043,NJ,"The Business Intelligence & Analytics master's program provides a blend of analytical and professional skills to help you become the kind of manager who challenges assumptions and uses data to make evidence-based decisions. At Stevens, you'll master new tools that will help you refine products, services and strategies while setting the pace for your company in markets undergoing constant, technology-driven change.

The curriculum covers the concepts at the forefront of the data revolution — machine learning, language processing, web mining, optimization and risk. Classes explore key business concepts while going beyond basics in R, SAS, Hadoop, Python and Spark. The program culminates in a capstone experience in which you'll work on a project, using real data, under the guidance of an industry mentor.",https://www.stevens.edu/school-business/masters-programs/business-intelligence-analytics
University of Connecticut, School of Business, M.S. in Business Analytics and Project Management,BA,2012,"352 Mansfield Rd. Unit 2048, Storrs, CT 06269-2048",-72.24947939,41.80824783,CT,"The MS in Business Analytics and Project Management (MSBAPM) is a top ranked, leading Master of Science program that teaches the skills that reach far beyond solving key business issues, it also provides students with the skills needed to become a leader in the industry. The 37-credit degree program allows students to establish and improve their skills in hands-on course work and transformative experiential learning through internships, data challenges, and consulting projects",https://msbapm.business.uconn.edu/#
University of Michigan at Dearborn, College of Business, M.S. in Business Analytics,BA,2012,"4901 Evergreen Rd, Dearborn, MI 48128-1491",-83.22732487,42.31333447,MI,The Master of Science-Business Analytics trains students to create business strategies using data and statistics.,https://umdearborn.edu/cob/graduate-programs/degree-programs/ms-business-analytics
University of San Francisco, College of Arts and Sciences, M.S. in Data Science (Formerly the M.S. in Analytics; renamed in 2018.),DS,2012,"2130 Fulton St, San Francisco, CA 94117-1080",-122.4509599,37.7752604,CA,"USF’s one-year Master of Science in Data Science (MSDS) program delivers a rigorous curriculum focused on mathematical and computational techniques in the emerging field of data science. The curriculum emphasizes the careful formulation of business problems, selecting effective analytical techniques to address those problems, and communicating solutions in a clear and creative fashion.",https://www.usfca.edu/arts-sciences/graduate-programs/data-science
Arizona State University, W.P. Carey School of Business, M.S. in Business Analytics,BA,2013,"P.O. Box 877705, Tempe, AZ 85287",-111.9281,33.42663608,AZ,"Be on the forefront of Big Data with a W. P. Carey Master of Science in Business Analytics (MS-BA) degree. This explosion of Big Data impacts every part of the global economy, making business analytics specialists one of the fastest-growing careers in our economy. You'll learn to derive value from data and modeling, lead data-driven analyses, and create a critical business advantage.",https://wpcarey.asu.edu/masters-programs/business-analytics
Benedictine University, College of Business, M.S. in Business Analytics,BA,2013,"5700 College Road, Lisle, IL 60532",-88.09328085,41.78006391,IL,"The educational approach of the program emphasizes practical application of technical tools and management theories to a variety of hypothetical and real-life data problems. Students gain an appreciation for the complexity of challenges associated with business analytics through group interaction, comprehensive projects, case analysis, research, and active participation in the sharing of individual experiences. This variety of teaching methods prepares students to be leaders in the 21st century.",https://www.ben.edu/college-of-business/graduate/msba-master-of-science-in-business-analytics.cfm
Carnegie Mellon University, School of Computer Science," M.S. in Computational Data Science (Formerly the MSIT in Very Large Information Systems,  renamed in 2013.)",DS,2013,"5000 Forbes Ave, Pittsburgh, PA 15213-3890",-79.9433955,40.4446265,PA,The Master of Computational Data Science program equips you with the skills and knowledge you need to develop the layers of technology involved in the next generation of massive information system deployments and analyze the data those systems generate.,https://mcds.cs.cmu.edu/
City University of New York, School of Professional Studies, M.S. in Data Science (Formerly the M.S. in Data Analytics; renamed in 2018.),DS,2013,"160 Convent Avenue, New York, NY 10031-9101",-73.95012097,40.8193748,NY,"The program’s learning objectives and demanding, hands-on courses are designed around employer needs. Throughout their time in the program, students build portfolios of increasingly complex projects using popular programming languages such as R and Python, which mirror the current experience and demands of the IT workplace. Students build predictive and prescriptive models, practice giving presentations, and review each other’s work in a convenient online setting, ensuring that they are equipped with the expertise most valued in today’s marketplace. The MS in Data Science program culminates with a capstone project that represents highly sophisticated, but practical, solutions to address real world problems.",https://sps.cuny.edu/academics/graduate/master-science-data-science-ms
George Washington University, School of Business, M.S. in Business Analytics,BA,2013,"1800 35th St NW, Washington, DC 20007",-77.069601,38.914695,DC,"Initiated in 2013, the GW School of Business MS in Business Analytics (MSBA) program trains students to master real-world analytics and consulting skills for effective data-driven decision making. Since its inception, the program has worked with leading analytics organizations (including IBM and Deloitte) to develop, and continue to enhance, a rigorous and balanced curriculum that encompasses the technical, quantitative and qualitative skills for effectively developing, deploying and communicating business analytics solutions.

The curriculum is a distinctive blend of analytics methods (descriptive, predictive, and prescriptive), applications (elective courses in analytics applied to a specific functional area or industry), soft skills (consulting, communication and team dynamics), and technology (SAS tools, R, Python, SQL, no-SQL and other current and trending technologies). The culmination of the course of study is a practicum project in which students work within a team of peers to apply their newly acquired expertise to real-world business challenges sponsored by our partner industry organizations.",https://business.gwu.edu/academics/programs/specialized-masters/ms-business-analytics
Harrisburg University of Science and Technology, M.S. in Analytics,M.S. in Analytics,A,2013,"326 Market Street, Harrisburg, PA 17101",-76.87996167,40.26171734,PA,"Data analysts are forging new relationships in virtually every discipline: business, healthcare, geology, mathematics and statistics, biology, chemistry, computer science, information systems and technology, engineering, psychology, behavioral science, operations research, and more, in addition to potential interactions between these disciplines, using role-based interaction with information and analytics to enable highly- collaborative, data-driven organizations. The graduate of this program enters the workforce prepared for the complex, information-intensive world.",https://www.harrisburgu.edu/academics/graduate/analytics/
Illinois Institute of Technology, College of Science, Master of Data Science,DS,2013,"10 W. 35th Street, Chicago, IL 60616",-87.627222,41.83102548,IL,"Students in the Master of Data Science program dive deeply into the underlying premises of given problems, learn to reformulate the questions, and determine if the results make sense. They do this by exploring and improving the structure of the available data, creating and evaluating models, and by constructing and testing hypotheses. They learn how to analyze the data, visualize the results and equally important, how to articulate their discoveries. 

By combining high-level mathematics, statistics, and computer science skills with the ability to communicate results, data scientists make a complicated and dynamic world more comprehensible. 

Illinois Tech’s rigorous data science curriculum provides the knowledge, skills, and experience to expand your career opportunities. Whether in Chicago with its diverse economy and thriving tech community or across the globe, our data science alumni have bright futures in the data science profession.",https://www.iit.edu/academics/programs/data-science-mas
Michigan State University, Eli Broad College of Business, M.S. in Business Data Science and Analytics (Formerly the M.S. in Business Analytics; renamed in 2021.),DS,2013,"450 Administration Bldg., East Lansing, MI 48824-1046",-84.48061146,42.72975452,MI,"The main themes of the Data Science and Business Analytics program focus on business strategy, data tools and management, and experiential project consulting. Graduates from Broad’s M.S. in Business Data Science and Analytics program have landed employment opportunities in a wide range of industries, such as consulting, automotive, consumer products, retail and financial services. Forty percent of graduates enter the field as a data scientist, while 60% follow a more business analyst career track. This Master’s in Data Science and Business Analytics program is designed to give training and hands-on experience to students in multiple areas of the data science and analytics field such as descriptive, predictive and prescriptive analytics.",https://broad.msu.edu/masters/business-data-science-analytics/
New York University, Stern School of Business, M.S. in Business Analytics,BA,2013,"70 Washington Square South, New York, NY 10012-1091",-73.99698732,40.72972537,NY,"Business Analytics is the intersection of business and data science, offering new opportunities for a competitive advantage. Business analytics unlocks the predictive potential of data analysis to improve financial performance, strategic management, and operational efficiency.
Graduates of this program will be equipped to influence decision-making and strategy, and they will ultimately drive better business results by gaining the ability to transform data into a powerful and predictive strategic asset. Business Analytics is critical in preparing organizations to solve 21st-century business challenges and participants of this program will have exposure to innovative methodologies that support data-driven decision making.",https://www.stern.nyu.edu/programs-admissions/ms-business-analytics
New York University, Center for Data Science, M.S. in Data Science,DS,2013,"70 Washington Square South, New York, NY 10012-1091",-73.99698732,40.72972537,NY,"The Master of Science in Data Science is a highly-selective program for students with a strong background in mathematics, computer science, and applied statistics. The degree focuses on the development of new methods for data science.

We live in the “Age of the Petabyte,” soon to become “The Age of the Exabyte.” Our networked world is generating a deluge of data that no human, or group of humans, can process fast enough. This data deluge has the potential to transform the way business, government, science, and healthcare are carried out. But too few possess the skills needed to use automated analytical tools and cut through the noise to create knowledge from big data.",https://cds.nyu.edu/
Pace University, Lubin School of Business, M.S. in Customer Intelligence and Analytics,A,2013,"1 Pace Plaza, New York, NY 10038-1598",-74.00554134,40.71178474,NY,"Our MS in Marketing Analytics is a focused degree designed for those who want to expand their experience with fact-based decision-making and gain the skills necessary to build a career in the fast-paced and lucrative field of marketing analytics. Get trained in a specialized niche while making connections in the industry, leveraging New York City’s energy in order to build the career you’re meant for.",https://www.pace.edu/program/marketing-analytics-ms
Rensselaer Polytechnic Institute, Lally School of Management, M.S. in Business Analytics,BA,2013,"110 8th St, Troy, NY 12180-3590",-73.6832025,42.731199,NY,"The business analytics master's program combines foundational business concepts with data management and statistical modeling, which are customized with electives such as natural language processing, machine learning, marketing, and supply chain management. Students will learn to think critically about data by working with diverse data sets, powerful computing and visualization resources, and real-world applications. The master's experience at Lally also includes mentoring from a highly engaged advisory board of executives.",https://lallyschool.rpi.edu/graduate-programs/business-analytics
Southern New Hampshire University, Online College, M.S. in Data Analytics,DA,2013,"2500 N River Rd, Manchester, NH 03106",-71.45394768,43.03771181,NH,"SNHU’s Master of Science (MS) in Data Analytics takes a deep dive into the study of analyzing data, allowing you to hone one of the most coveted skill sets in today’s workforce. You’ll learn how to use advanced statistical techniques and tools in data and information management to collect and analyze large data sets. You'll also learn how to apply your computational, analytical and modeling skills to provide decision support to key stakeholders.",https://www.snhu.edu/online-degrees/masters/ms-in-data-analytics
Texas A&M University, College of Science, M.S. in Analytics,A,2013,"1246 TAMU, College Station, TX 77843",-96.3568091,30.62031,TX,"The Master of Science in Data Science degree is an on-campus interdisciplinary program offered by the Departments of Computer Science and Engineering, Electrical and Computer Engineering, Mathematics, and Statistics within the University’s Colleges of Engineering and Science, and administered jointly with the Texas A&M Institute of Data Science.

Each of the four academic departments offers a track in the program. Students will be admitted to an individual track which they will maintain for the duration of their study. The multidisciplinary curriculum (see below) provides students with a solid foundation in mathematics, statistics, computer science, and machine learning through core courses, after which students are able to chose from electives courses provided by the different participating departments.

The MS in Data Science program prepares a student for a variety of career options associated with data science; including consulting agencies, financial services firms, government agencies, healthcare and pharmaceutical companies, marketing services, private commercial corporations, and technology companies. ",https://tamids.tamu.edu/msds/
